{
  "schema_version": 1,
  "policy_version": "0.1.0",
  "profiles": {
    "nist-general": {
      "description": "Evidence-grounded general-purpose PQC migration profile.",
      "authorities": ["NIST.FIPS.203", "NIST.FIPS.204", "NIST.FIPS.205", "NIST.SP.800-227", "NIST.IR.8547.IPD", "NIST.SP.800-57", "QG.ENGINEERING"]
    }
  },
  "authorities": {
    "QG.ENGINEERING": {
      "title": "PQCensus evidence and abstention policy",
      "publisher": "PQCensus",
      "status": "internal",
      "kind": "engineering-interpretation",
      "url": "https://github.com/XiantingWu/PQCensus/blob/main/docs/RULES.md",
      "version": "0.1.0",
      "publication_date": "2026-08-23",
      "notes": "Tool behavior, not an external cryptographic standard. It is explicitly separated from NIST and other authorities."
    },
    "NIST.FIPS.203": {
      "title": "Module-Lattice-Based Key-Encapsulation Mechanism Standard",
      "publisher": "NIST",
      "status": "final",
      "kind": "formal-standard",
      "url": "https://doi.org/10.6028/NIST.FIPS.203",
      "version": "FIPS 203",
      "publication_date": "2024-08-13",
      "notes": "Final standard. NIST posted a 2025 planning note identifying potential errata for a future update."
    },
    "NIST.FIPS.204": {
      "title": "Module-Lattice-Based Digital Signature Standard",
      "publisher": "NIST",
      "status": "final",
      "kind": "formal-standard",
      "url": "https://doi.org/10.6028/NIST.FIPS.204",
      "version": "FIPS 204",
      "publication_date": "2024-08-13",
      "notes": "Final standard. Consult the current NIST publication page for errata planning notes."
    },
    "NIST.FIPS.205": {
      "title": "Stateless Hash-Based Digital Signature Standard",
      "publisher": "NIST",
      "status": "final",
      "kind": "formal-standard",
      "url": "https://doi.org/10.6028/NIST.FIPS.205",
      "version": "FIPS 205",
      "publication_date": "2024-08-13",
      "notes": "Final standard. Additional limited-use parameter sets remain separate draft work and are not treated as final here."
    },
    "NIST.SP.800-227": {
      "title": "Recommendations for Key-Encapsulation Mechanisms",
      "publisher": "NIST",
      "status": "final",
      "kind": "implementation-guidance",
      "url": "https://doi.org/10.6028/NIST.SP.800-227",
      "version": "SP 800-227",
      "publication_date": "2025-09-18",
      "notes": "Final recommendations for securely implementing and using KEMs."
    },
    "NIST.IR.8547.IPD": {
      "title": "Transition to Post-Quantum Cryptography Standards",
      "publisher": "NIST",
      "status": "draft",
      "kind": "migration-guidance",
      "url": "https://doi.org/10.6028/NIST.IR.8547.ipd",
      "version": "Initial Public Draft",
      "publication_date": "2024-11-12",
      "notes": "Draft transition guidance. It is not represented as a final NIST standard."
    },
    "NIST.SP.800-57": {
      "title": "Recommendation for Key Management",
      "publisher": "NIST",
      "status": "guidance",
      "kind": "migration-guidance",
      "url": "https://csrc.nist.gov/publications/detail/sp/800-57-part-1/rev-5/final",
      "version": "SP 800-57 Part 1 Revision 5",
      "publication_date": "2020-05-04",
      "notes": "General key-management guidance; PQCensus does not treat it as a purpose-specific PQC replacement table."
    }
  },
  "rules": [
    {
      "id": "QG-RSA-SIGNATURE",
      "category": "public-key",
      "algorithm_family": "RSA",
      "purposes": ["SIGNATURE"],
      "quantum_status": "shor-vulnerable",
      "default_severity": "HIGH",
      "recommendation": "Migrate the signature workflow to ML-DSA or SLH-DSA after protocol and certificate compatibility review.",
      "migration_targets": ["ML-DSA", "SLH-DSA"],
      "authority_ids": ["NIST.FIPS.204", "NIST.FIPS.205", "NIST.IR.8547.IPD"],
      "status": "stable",
      "effective_version": "0.1.0",
      "deprecated": false,
      "profiles": ["nist-general"],
      "interpretation": "PQCensus maps verified signature usage to signature-class PQC candidates. Severity and deployment ordering are PQCensus engineering judgments, not NIST certification."
    },
    {
      "id": "QG-RSA-KEY-TRANSPORT",
      "category": "public-key",
      "algorithm_family": "RSA",
      "purposes": ["ENCRYPTION", "KEY_ESTABLISHMENT"],
      "quantum_status": "shor-vulnerable",
      "default_severity": "HIGH",
      "recommendation": "Migrate key establishment or key transport to ML-KEM or a supported hybrid protocol transition; do not substitute a signature algorithm.",
      "migration_targets": ["ML-KEM"],
      "authority_ids": ["NIST.FIPS.203", "NIST.SP.800-227", "NIST.IR.8547.IPD"],
      "status": "stable",
      "effective_version": "0.1.0",
      "deprecated": false,
      "profiles": ["nist-general"],
      "interpretation": "PQCensus maps verified encryption or key-establishment usage to KEM-class candidates. Neutral-context findings are high severity; supplied exposure, confidentiality lifetime, and HNDL context can raise urgency to critical. Severity is PQCensus engineering guidance."
    },
    {
      "id": "QG-ECDSA-SIGNATURE",
      "category": "public-key",
      "algorithm_family": "ECDSA",
      "purposes": ["SIGNATURE", "CERTIFICATE"],
      "quantum_status": "shor-vulnerable",
      "default_severity": "HIGH",
      "recommendation": "Plan a certificate and signature migration to ML-DSA or SLH-DSA with verifier rollout before issuer changes.",
      "migration_targets": ["ML-DSA", "SLH-DSA"],
      "authority_ids": ["NIST.FIPS.204", "NIST.FIPS.205", "NIST.IR.8547.IPD"],
      "status": "stable",
      "effective_version": "0.1.0",
      "deprecated": false,
      "profiles": ["nist-general"],
      "interpretation": "PQCensus treats ECDSA as a signature primitive and preserves PKI/verifier constraints. Severity and urgency are tool judgments."
    },
    {
      "id": "QG-ECDH-KEY-ESTABLISHMENT",
      "category": "public-key",
      "algorithm_family": "ECDH",
      "purposes": ["KEY_ESTABLISHMENT"],
      "quantum_status": "shor-vulnerable",
      "default_severity": "HIGH",
      "recommendation": "Use a protocol-aware hybrid transition candidate combining classical and ML-KEM key establishment before retiring ECDH.",
      "migration_targets": ["ML-KEM"],
      "authority_ids": ["NIST.FIPS.203", "NIST.SP.800-227", "NIST.IR.8547.IPD"],
      "status": "stable",
      "effective_version": "0.1.0",
      "deprecated": false,
      "profiles": ["nist-general"],
      "interpretation": "PQCensus treats ECDH as key agreement and recommends protocol-aware KEM transition planning, not an algorithm-name substitution."
    },
    {
      "id": "QG-X25519-KEY-ESTABLISHMENT",
      "category": "public-key",
      "algorithm_family": "X25519",
      "purposes": ["KEY_ESTABLISHMENT"],
      "quantum_status": "shor-vulnerable",
      "default_severity": "HIGH",
      "recommendation": "Assess a protocol-supported hybrid key-establishment transition using ML-KEM; X25519 is not a signature and must not map to ML-DSA.",
      "migration_targets": ["ML-KEM"],
      "authority_ids": ["NIST.FIPS.203", "NIST.SP.800-227", "NIST.IR.8547.IPD"],
      "status": "stable",
      "effective_version": "0.1.0",
      "deprecated": false,
      "profiles": ["nist-general"],
      "interpretation": "PQCensus treats X25519 as key agreement and preserves negotiation and peer-compatibility unknowns."
    },
    {
      "id": "QG-X448-KEY-ESTABLISHMENT",
      "category": "public-key",
      "algorithm_family": "X448",
      "purposes": ["KEY_ESTABLISHMENT"],
      "quantum_status": "shor-vulnerable",
      "default_severity": "HIGH",
      "recommendation": "Assess a protocol-supported hybrid key-establishment transition using ML-KEM; X448 is not a signature and must not map to ML-DSA.",
      "migration_targets": ["ML-KEM"],
      "authority_ids": ["NIST.FIPS.203", "NIST.SP.800-227", "NIST.IR.8547.IPD"],
      "status": "stable",
      "effective_version": "0.1.0",
      "deprecated": false,
      "profiles": ["nist-general"],
      "interpretation": "PQCensus treats X448 as a distinct key-agreement primitive and preserves negotiation and peer-compatibility unknowns."
    },
    {
      "id": "QG-DH-KEY-ESTABLISHMENT",
      "category": "public-key",
      "algorithm_family": "finite-field DH",
      "purposes": ["KEY_ESTABLISHMENT"],
      "quantum_status": "shor-vulnerable",
      "default_severity": "HIGH",
      "recommendation": "Assess a protocol-supported hybrid transition to ML-KEM before retiring finite-field Diffie-Hellman.",
      "migration_targets": ["ML-KEM"],
      "authority_ids": ["NIST.FIPS.203", "NIST.SP.800-227", "NIST.IR.8547.IPD"],
      "status": "stable",
      "effective_version": "0.1.0",
      "deprecated": false,
      "profiles": ["nist-general"],
      "interpretation": "PQCensus treats finite-field DH as key agreement and requires protocol-aware migration planning."
    },
    {
      "id": "QG-EDDSA-SIGNATURE",
      "category": "public-key",
      "algorithm_family": "EdDSA",
      "purposes": ["SIGNATURE", "CERTIFICATE"],
      "quantum_status": "shor-vulnerable",
      "default_severity": "HIGH",
      "recommendation": "Plan a verifier-first signature migration to ML-DSA or SLH-DSA; preserve certificate and software-signing compatibility constraints.",
      "migration_targets": ["ML-DSA", "SLH-DSA"],
      "authority_ids": ["NIST.FIPS.204", "NIST.FIPS.205", "NIST.IR.8547.IPD"],
      "status": "stable",
      "effective_version": "0.1.0",
      "deprecated": false,
      "profiles": ["nist-general"],
      "interpretation": "PQCensus treats EdDSA families as signatures and retains verifier and certificate compatibility as unresolved deployment context."
    },
    {
      "id": "QG-ML-KEM",
      "category": "pqc",
      "algorithm_family": "ML-KEM",
      "purposes": ["KEY_ESTABLISHMENT", "ENCRYPTION"],